{
  "confidence": "high",
  "content_hash": "sha256:aa0117f3dd9c07e5706dd90ed9a4b129e5ce6251873f37eb6ae1e0ccec2a6f07",
  "created_at": "2026-05-04T20:21:52+02:00",
  "evidence": [
    {
      "id": "synthesis.feature-map",
      "kind": "memory"
    }
  ],
  "from": "project.aictx",
  "id": "rel.project-aictx-implements-concept-feature-cli-binary-aictx",
  "predicate": "implements",
  "status": "stale",
  "to": "concept.feature-cli-binary-aictx",
  "updated_at": "2026-05-05T13:43:35+02:00"
}
