{
  "content_hash": "sha256:f786e727d89878d03cd0cf3ca303c51888d6a2831311a381c71d046d8ffcd233",
  "created_at": "2026-05-05T13:30:07+02:00",
  "from": "synthesis.feature-map",
  "id": "rel.synthesis-feature-map-supersedes-concept-feature-cli-command-graph",
  "predicate": "supersedes",
  "status": "active",
  "to": "concept.feature-cli-command-graph",
  "updated_at": "2026-05-05T13:30:07+02:00"
}
