{
  "confidence": "medium",
  "content_hash": "sha256:4e5a11efe6181ac5f4d9147f40479bfbb3bc0e47587875e0bc5f46b81e1e2f0d",
  "created_at": "2026-05-14T16:55:37+02:00",
  "from": "question.llm-wiki-product-alignment",
  "id": "rel.question-llm-wiki-product-alignment-affects-synthesis-feature-map",
  "predicate": "affects",
  "status": "active",
  "to": "synthesis.feature-map",
  "updated_at": "2026-05-14T16:55:37+02:00"
}
