{
  "content_hash": "sha256:d2c083329b2f92731a4ec3f58d6222e98a1bf9b2ba9d03286d15f9b86b6fba14",
  "created_at": "2026-05-05T22:56:56+02:00",
  "from": "workflow.cloudflare-public-site-deployment",
  "id": "rel.workflow-cloudflare-public-site-deployment-supersedes-workflow-vercel-public-site-deployment",
  "predicate": "supersedes",
  "status": "active",
  "to": "workflow.vercel-public-site-deployment",
  "updated_at": "2026-05-05T22:56:56+02:00"
}
