{
  "content_hash": "sha256:ab87c36257719919dd79c510e3baa9cb90a1e172a1b1ca1d09c4d5ad451fbfd0",
  "created_at": "2026-05-05T13:30:07+02:00",
  "from": "synthesis.feature-map",
  "id": "rel.synthesis-feature-map-supersedes-concept-feature-cli-command-export",
  "predicate": "supersedes",
  "status": "active",
  "to": "concept.feature-cli-command-export",
  "updated_at": "2026-05-05T13:30:07+02:00"
}
