{
  "confidence": "high",
  "content_hash": "sha256:5299ef008d4cd7d7caa8ab0bcc37eb837ee3caeaeb36e1cb269fbca8677c2485",
  "created_at": "2026-05-04T20:07:14+02:00",
  "evidence": [
    {
      "id": "src/registry/projects.ts",
      "kind": "file"
    }
  ],
  "from": "project.aictx",
  "id": "rel.project-aictx-implements-concept-feature-project-registry",
  "predicate": "implements",
  "status": "active",
  "to": "concept.feature-project-registry",
  "updated_at": "2026-05-04T20:07:14+02:00"
}
