{
  "content_hash": "sha256:17f45439abd4160a542df8e7ebfa075480fcc1b123680b3a030c9d24c4e2bda3",
  "created_at": "2026-05-05T13:30:07+02:00",
  "from": "synthesis.feature-map",
  "id": "rel.synthesis-feature-map-supersedes-concept-feature-cli-command-obsidian",
  "predicate": "supersedes",
  "status": "active",
  "to": "concept.feature-cli-command-obsidian",
  "updated_at": "2026-05-05T13:30:07+02:00"
}
