{
  "content_hash": "sha256:0827ab2f3956733b516a4a53f6ed7356705a71df39924120fda3829234bccc55",
  "created_at": "2026-05-05T13:30:07+02:00",
  "from": "synthesis.feature-map",
  "id": "rel.synthesis-feature-map-supersedes-concept-feature-cli-command-check",
  "predicate": "supersedes",
  "status": "active",
  "to": "concept.feature-cli-command-check",
  "updated_at": "2026-05-05T13:30:07+02:00"
}
