{
  "confidence": "high",
  "content_hash": "sha256:d8d4962c055419079853a20b309cc257ad93faee56042ba803730c15670aea47",
  "created_at": "2026-05-04T18:04:45+02:00",
  "evidence": [
    {
      "id": "src/cli/commands/export.ts",
      "kind": "file"
    }
  ],
  "from": "project.aictx",
  "id": "rel.project-aictx-implements-concept-feature-cli-command-export",
  "predicate": "implements",
  "status": "active",
  "to": "concept.feature-cli-command-export",
  "updated_at": "2026-05-04T18:04:45+02:00"
}
