{
  "content_hash": "sha256:6fbca52586aa791b68004110bb3dd9b1551ff5c8b3cab6a2bb57473dc50dce05",
  "created_at": "2026-05-05T13:30:07+02:00",
  "from": "synthesis.feature-map",
  "id": "rel.synthesis-feature-map-supersedes-concept-feature-cli-command-audit",
  "predicate": "supersedes",
  "status": "active",
  "to": "concept.feature-cli-command-audit",
  "updated_at": "2026-05-05T13:30:07+02:00"
}
