{
  "content_hash": "sha256:ca8dd1f0c7f08df3a00609d67619a55f8579bd33cc5194554b43a21389cdd81a",
  "created_at": "2026-05-05T13:30:07+02:00",
  "from": "synthesis.feature-map",
  "id": "rel.synthesis-feature-map-supersedes-concept-feature-cli-binary-aictx",
  "predicate": "supersedes",
  "status": "active",
  "to": "concept.feature-cli-binary-aictx",
  "updated_at": "2026-05-05T13:30:07+02:00"
}
