{
  "confidence": "high",
  "content_hash": "sha256:0cd02f565c073332b1115bf7e56fcfc376bf8ae3707a6e9489ce70041d02be70",
  "created_at": "2026-05-05T13:30:07+02:00",
  "evidence": [
    {
      "id": "synthesis.feature-map",
      "kind": "memory"
    }
  ],
  "from": "project.aictx",
  "id": "rel.project-aictx-implements-synthesis-feature-map",
  "predicate": "implements",
  "status": "active",
  "to": "synthesis.feature-map",
  "updated_at": "2026-05-05T13:43:35+02:00"
}
